Norma;Descricao da Sigla;Data de Apresentacao;Autor;Partido;Ementa;Link Documento PDF;Link Página Web;Indexacao;Último Estado;Data Último Estado;Situação;Score Final;Boost Keyword;Similaridade Semantica
PL 4089/2024;Projeto de Lei;2024-10-25;Marcos Tavares;PDT;Dispõe sobre a proteção dos direitos dos consumidores no uso de produtos e serviços que utilizam Inteligência Artificial (IA), estabelecendo diretrizes para garantir transparência, equidade e o respeito à privacidade dos usuários.;https://www.camara.leg.br/proposicoesWeb/prop_mostrarintegra?codteor=2490822;https://www.camara.leg.br/proposicoesWeb/fichadetramitacao?idProposicao=2464691;Defesa do consumidor, utilização, inteligência artificial, tecnologia, diretrizes, transparência.;Devolução ao(à) Relator(a);2026-02-04;Aguardando Parecer;0.6091;TOTAL (2 Termos);0.5114
PL 177/2024;Projeto de Lei;2024-02-06;Saullo Vianna;UNIÃO;“Institui a Campanha de Conscientização e Prevenção contra Crimes Cibernéticos, cometidos por meio do uso indevido da inteligência artificial, contra crianças e adolescentes.”;https://www.camara.leg.br/proposicoesWeb/prop_mostrarintegra?codteor=2385470;https://www.camara.leg.br/proposicoesWeb/fichadetramitacao?idProposicao=2417362;Criação, Campanha de Conscientização e Prevenção contra Crimes Cibernéticos, Cometidos por meio do Uso Indevido da Inteligência Artificial, contra Crianças e Adolescentes, diretrizes.;Abertura de Prazo;2025-12-16;Aguardando Parecer;0.6058;TOTAL (2 Termos);0.5073
PL 6036/2025;Projeto de Lei;2025-11-28;Ricardo Abrão;UNIÃO;Estabelece normas gerais para identificação obrigatória de conteúdos produzidos total ou parcialmente por sistemas de Inteligência Artificial, cria o Selo Nacional de Conteúdo Sintético, dispõe sobre deveres de transparência das plataformas digitais, define mecanismos de detecção automática, obriga declaração de uso de IA por usuários, estabelece responsabilidades e penalidades, assegura proteção ao consumidor e ao processo democrático, altera a Lei nº 12.965, de 23 de abril de 2014 (Marco Civil da Internet), e a Lei nº 13.709, de 14 de agosto de 2018 (Lei Geral de Proteção de Dados), e dá outras providências.;https://www.camara.leg.br/proposicoesWeb/prop_mostrarintegra?codteor=3054879;https://www.camara.leg.br/proposicoesWeb/fichadetramitacao?idProposicao=2589443;Alteração, Marco Civil da Internet (2014), Lei Geral de Proteção de Dados Pessoais (LGPDP) (2018), critério, obrigatoriedade, identificação, conteúdo audiovisual, conteúdo digital, procedência, inteligência artificial, criação, Selo Nacional de Conteúdo Sintético (SNCS), dever de transparência, plataforma digital, meios, detecção,  proteção, consumidor, direito do consumidor, democracia, diretrizes.;Apresentação de Proposição;2025-11-28;Aguardando Despacho do Presidente da Câmara dos Deputados (Chancela);0.6026;TOTAL (2 Termos);0.5033
PL 303/2024;Projeto de Lei;2024-02-20;Júnior Mano;PSB;Altera o art. 6º da Lei nº 9.279, de 14 de maio de 1996, para dispor sobre a titularidade de invenções geradas de forma autônoma por sistemas de inteligência artificial.;https://www.camara.leg.br/proposicoesWeb/prop_mostrarintegra?codteor=2387544;https://www.camara.leg.br/proposicoesWeb/fichadetramitacao?idProposicao=2418048;Alteração, Lei de Propriedade Industrial, titularidade, invenção, geração, forma autônoma, Sistema de inteligência artificial.;Designação de Relator(a);2025-06-11;Aguardando Parecer;0.6023;PARCIAL (1 Termo);0.6279
PL 2983/2025;Projeto de Lei;2025-06-18;Prof. Reginaldo Veras;PV;Dispõe sobre a obrigatoriedade de identificação de conteúdos audiovisuais gerados por inteligência artificial e estabelece medidas para proteção dos consumidores digitais.;https://www.camara.leg.br/proposicoesWeb/prop_mostrarintegra?codteor=2938663;https://www.camara.leg.br/proposicoesWeb/fichadetramitacao?idProposicao=2527110;Obrigatoriedade, Identificação visual, Conteúdo digital, criação, geração, Inteligência artificial, proteção, Consumidor, incentivo, Educação midiática.;Recebimento;2025-09-23;Tramitando em Conjunto;0.5989;TOTAL (2 Termos);0.4986
PL 6712/2025;Projeto de Lei;2025-12-22;Amom Mandel;CIDADANIA;Estabelece a obrigatoriedade de identificação prévia de chamadas telefônicas automatizadas e de ligações realizadas por sistemas de inteligência artificial, e dá outras providências.;https://www.camara.leg.br/proposicoesWeb/prop_mostrarintegra?codteor=3072077;https://www.camara.leg.br/proposicoesWeb/fichadetramitacao?idProposicao=2599305;Obrigatoriedade, identificação, Ligação telefônica, Identificador de chamadas, Robocall, Telemarketing, Inteligência artificial.;Apresentação de Proposição;2025-12-22;Aguardando Chancela e Publicação do Despacho;0.5984;PARCIAL (1 Termo);0.6230
PL 1290/2025;Projeto de Lei;2025-03-27;Hildo Rocha;MDB;Altera a Lei nº 9.784, de 29 de janeiro de 1999, para regulamentar o uso da inteligência artificial nos processos administrativos, no âmbito da Administração Pública Federal.;https://www.camara.leg.br/proposicoesWeb/prop_mostrarintegra?codteor=2874393;https://www.camara.leg.br/proposicoesWeb/fichadetramitacao?idProposicao=2490659;Alteração, Lei Geral do Processo Administrativo (1999), regulamentação, utilização, inteligência artificial, processo administrativo, âmbito, Administração federal, diretrizes.;Apresentação de Requerimento;2025-08-05;Aguardando Parecer;0.5976;TOTAL (2 Termos);0.4970
PL 3967/2025;Projeto de Lei;2025-08-12;Laura Carneiro;PSD;Altera a Lei nº 12.965, de 23 de abril de 2014 (Marco Civil da Internet), para dispor sobre a obrigatoriedade de identificação de conteúdo gerado por inteligência artificial.;https://www.camara.leg.br/proposicoesWeb/prop_mostrarintegra?codteor=2971761;https://www.camara.leg.br/proposicoesWeb/fichadetramitacao?idProposicao=2543191;Alteração, Marco Civil da Internet (2014), obrigatoriedade, plataforma digital, identificação, conteúdo digital, Inteligência artificial.;Recebimento;2025-09-23;Tramitando em Conjunto;0.5976;PARCIAL (1 Termo);0.6220
PL 2421/2023;Projeto de Lei;2023-05-09;Camila Jara;PT;Dispõe sobre a criação do Fundo de Renda Básica, que será utilizado para redistribuição de renda para os trabalhadores afetados pelo uso de inteligência artificial e alto grau de automação no mercado de trabalho.;https://www.camara.leg.br/proposicoesWeb/prop_mostrarintegra?codteor=2269690;https://www.camara.leg.br/proposicoesWeb/fichadetramitacao?idProposicao=2360834;Criação, Fundo de Renda Básica, redistribuição, renda, trabalhador, afetação, Inteligência artificial, automação, robótica, mercado de trabalho. _Composição, Fundo de Renda Básica, alíquota, adicional, lucro líquido, empresa, utilização, inteligência artificial, automação, robótica, Contribuição Social sobre o Lucro Líquido (CSLL), Imposto de Renda das Pessoas Jurídicas (IRPJ). _Alteração, Lei Federal, aumento, alíquota, Contribuição Social sobre o Lucro Líquido (CSLL), empresa, utilização, Inteligência artificial, automação, robótica. _Finalidade, redistribuição, renda, trabalhador, precarização do trabalho, decorrência, inteligência artificial.;Notificacao para Publicação Intermediária;2025-07-03;Tramitando em Conjunto;0.5930;TOTAL (2 Termos);0.4912
PL 1635/2024;Projeto de Lei;2024-05-07;Vinicius Carvalho;REPUBLICANOS;Dispõe sobre a proteção do consumidor contra práticas de colusão artificial implementadas por meio de algoritmos de precificação.;https://www.camara.leg.br/proposicoesWeb/prop_mostrarintegra?codteor=2418447;https://www.camara.leg.br/proposicoesWeb/fichadetramitacao?idProposicao=2431834;Alteração, Código de Defesa do Consumidor (1990), proteção, defesa do consumidor, vedação, conluio, algoritmo, inteligência artificial, inteligência artificial, precificação dinâmica, prejuízo, livre concorrência.;Apensação;2024-06-19;Tramitando em Conjunto;0.5923;TOTAL (2 Termos);0.4904
PL 3091/2025;Projeto de Lei;2025-06-26;Fabio Schiochet;UNIÃO;Altera a Lei nº 8.078, de 11 de setembro de 1990 (Código de Defesa do Consumidor), para vedar, no âmbito das relações de consumo, o uso de conteúdos gerados por inteligência artificial que simulem, de forma realista, profissionais da saúde, autoridades públicas ou especialistas, com o objetivo de influenciar decisões de compra, adesão ou consumo.;https://www.camara.leg.br/proposicoesWeb/prop_mostrarintegra?codteor=2942701;https://www.camara.leg.br/proposicoesWeb/fichadetramitacao?idProposicao=2528688;Alteração, Código de Defesa do Consumidor (1990), critério, proibição, utilização, representação, profissional de saúde, utoridade pública, Autoridade, inteligência artificial, finalidade, influência, decisão, compra, adesão, consumo.;Encerramento de Prazo;2025-10-16;Aguardando Parecer;0.5911;TOTAL (2 Termos);0.4889
PL 6119/2023;Projeto de Lei;2023-12-20;Kim Kataguiri;UNIÃO;Altera o Decreto-Lei nº 2848, de 07 de dezembro de 1940 – Código Penal, para dispor sobre o uso fraudulento de inteligência artificial.;https://www.camara.leg.br/proposicoesWeb/prop_mostrarintegra?codteor=2380072;https://www.camara.leg.br/proposicoesWeb/fichadetramitacao?idProposicao=2415560;Alteração, Código Penal (1940), Crime contra o patrimônio, tipicidade penal, Fraude publicitária com uso de inteligência artificial.;Recebimento;2025-07-28;Aguardando Designação de Relator(a);0.5897;PARCIAL (1 Termo);0.6122
PL 3392/2024;Projeto de Lei;2024-08-30;Júnior Mano;PSB;Estabelece diretrizes para o uso ético de tecnologias de inteligência artificial na replicação de vozes de artistas e dubladores em anúncios digitais e outras produções audiovisuais, garantindo o consentimento explícito e a justa remuneração dos envolvidos, reforça a proteção jurídica da voz como direito garantido à imagem, e estabelece mecanismos de fiscalização e reparação.;https://www.camara.leg.br/proposicoesWeb/prop_mostrarintegra?codteor=2471841;https://www.camara.leg.br/proposicoesWeb/fichadetramitacao?idProposicao=2456204;Diretrizes, utilização, inteligência artificial, reprodução, voz humana, artista, ator dublador, anúncio online, publicidade digital, obra audiovisual. _Proteção legal, voz humana, direito de propriedade intelectual.;Encerramento de Prazo;2026-02-10;Pronta para Pauta;0.5893;TOTAL (2 Termos);0.4866
PL 649/2026;Projeto de Lei;2026-02-23;Marcos Tavares;PDT;Institui a obrigatoriedade de utilização de câmeras corporais e veiculares dotadas de Inteligência Artificial para reconhecimento facial e leitura automática de placas de veículos, integradas exclusivamente a bancos oficiais de mandados de prisão e restrição judicial, estabelece regras de governança algorítmica, proteção de dados, auditoria independente e responsabilização funcional, e dá outras providências.;https://www.camara.leg.br/proposicoesWeb/prop_mostrarintegra?codteor=3085934;https://www.camara.leg.br/proposicoesWeb/fichadetramitacao?idProposicao=2603749;Obrigatoriedade, câmera corporal, inteligência artificial, reconhecimento facial, recaptura de foragido, leitura, placa de identificação de veículo automotor, transparência algorítmica, tratamento de dados, diretrizes, segurança pública, tecnologia.;Apresentação de Proposição;2026-02-23;;0.5870;TOTAL (2 Termos);0.4837
PL 1473/2023;Projeto de Lei;2023-03-28;Aureo Ribeiro;SOLIDARIEDADE;Esta Lei torna obrigatória a disponibilização, por parte das empresas que operam sistemas de inteligência artificial, de ferramentas que garantam aos autores de conteúdo na internet a possibilidade de restringir o uso de seus materiais pelos algoritmos de inteligência artificial, com o objetivo de preservar os direitos autorais.;https://www.camara.leg.br/proposicoesWeb/prop_mostrarintegra?codteor=2251301;https://www.camara.leg.br/proposicoesWeb/fichadetramitacao?idProposicao=2353916;Obrigatoriedade, empresa, operação, inteligência artificial, disponibilização, ferramenta tecnológica, garantia, Autor (publicação), conteúdo digital, internet, restrição, utilização, material informativo, algoritmo, finalidade, preservação, Direito autoral.;Apresentação de Requerimento;2025-10-21;Aguardando Parecer;0.5859;TOTAL (2 Termos);0.4824
PL 6708/2025;Projeto de Lei;2025-12-22;Amom Mandel;CIDADANIA;Altera a Lei nº 9.394, de 20 de dezembro de 1996 (Lei de Diretrizes e Bases da Educação Nacional - LDB), para incluir o tema Inteligência Artificial, literacia digital e ética algorítmica como componente curricular transversal obrigatório.;https://www.camara.leg.br/proposicoesWeb/prop_mostrarintegra?codteor=3071973;https://www.camara.leg.br/proposicoesWeb/fichadetramitacao?idProposicao=2599301;Alteração, Lei de Diretrizes e Bases da Educação Nacional (1996), inclusão, Inteligência artificial, Inteligência artificial generativa, Ética digital, Componente curricular, Currículo escolar, Tema transversal, Ensino transdisciplinar, Ensino fundamental, Ensino médio.;Apresentação de Proposição;2025-12-22;Aguardando Despacho do Presidente da Câmara dos Deputados (Chancela);0.5852;TOTAL (2 Termos);0.4815
PL 5931/2023;Projeto de Lei;2023-12-07;Carlos Chiodini;MDB;Altera a Lei n º 9.504, de 30 de setembro de 1997 (Lei das Eleições) para dispor sobre o uso da inteligência artificial em propaganda eleitoral.;https://www.camara.leg.br/proposicoesWeb/prop_mostrarintegra?codteor=2373073;https://www.camara.leg.br/proposicoesWeb/fichadetramitacao?idProposicao=2411790;Alteração, Lei das Eleições (1997), regulamentação, utilização, inteligência artificial, propaganda eleitoral.;Apresentação de Requerimento;2024-02-06;Tramitando em Conjunto;0.5825;TOTAL (2 Termos);0.4782
PL 791/2023;Projeto de Lei;2023-03-02;Emanuel Pinheiro Neto;MDB;Estabelece procedimentos a serem adotados pela União em regime de colaboração com os Estados, Distrito Federal e Municípios em situação de riscos e desastres mediante o uso de Sistemas de Processamento de Dados e de Inteligência Artificial (IA), com objetivo na organização, solução e implementação integrada e da outras providências.;https://www.camara.leg.br/proposicoesWeb/prop_mostrarintegra?codteor=2238986;https://www.camara.leg.br/proposicoesWeb/fichadetramitacao?idProposicao=2349820;Colaboração, União, Estado (ente federado), Distrito Federal (Brasil), Município, Sistema computacional, Processamento de Dados, Inteligência artificial, Situação de risco, desastre ambiental, Desastre humano, prevenção, fiscalização, desmatamento, exploração florestal, proteção ambiental, diretrizes.;Designação de Relator(a);2025-06-02;Aguardando Parecer;0.5811;TOTAL (2 Termos);0.4764
PL 357/2024;Projeto de Lei;2024-02-21;Lucio Mosquini;MDB;Altera a Lei nº 9.394, de 20 de dezembro de 1996, que trata das diretrizes e bases da educação nacional, para dispor sobre a inclusão das atividades de Inteligência Artificial como ensino técnico profissionalizante, na forma subsequente, em cursos destinados a quem tenha concluído o ensino médio.;https://www.camara.leg.br/proposicoesWeb/prop_mostrarintegra?codteor=2388267;https://www.camara.leg.br/proposicoesWeb/fichadetramitacao?idProposicao=2418325;Alteração, Lei de Diretrizes e Bases da Educação Nacional (1996), inclusão, atividade, inteligência artificial, ensino técnico, ensino profissionalizante, posterioridade, ensino médio.;Publicação de Proposição;2024-02-27;Tramitando em Conjunto;0.5784;TOTAL (2 Termos);0.4730
PL 4308/2025;Projeto de Lei;2025-08-28;Tião Medeiros;PP;Altera a Lei no 12.965, de 23 de abril de 2014 (Marco Civil da Internet), para dispor sobre a obrigatoriedade de aviso ao usuário do emprego de ferramentas de inteligência artificial em aplicação de internet.;https://www.camara.leg.br/proposicoesWeb/prop_mostrarintegra?codteor=2988307;https://www.camara.leg.br/proposicoesWeb/fichadetramitacao?idProposicao=2554623;Alteração, Marco Civil da Internet (2014), obrigatoriedade, provedor de aplicações, aviso, utilização, inteligência artificial, conteúdo digital, diretrizes.;Recebimento;2025-09-23;Tramitando em Conjunto;0.5780;TOTAL (2 Termos);0.4725
PL 7174/2025;Projeto de Lei;2025-12-22;Amom Mandel;CIDADANIA;Institui o Selo Nacional de Ética Algorítmica para Produtos Educacionais Digitais utilizados por instituições públicas de ensino e dá outras providências.;https://www.camara.leg.br/proposicoesWeb/prop_mostrarintegra?codteor=3072721;https://www.camara.leg.br/proposicoesWeb/fichadetramitacao?idProposicao=2599783;Criação, selo de certificação, ética digital, algoritmo, educação, inteligência artificial, tecnologia interativa digital de informação e comunicação (TIDIC), proteção, dados pessoais, transparência, diretrizes.;Apresentação de Proposição;2025-12-22;Aguardando Chancela e Publicação do Despacho;0.5760;TOTAL (2 Termos);0.4700
PL 1539/2024;Projeto de Lei;2024-05-06;Carlos Henrique Gaguim;UNIÃO;Institui o Fundo de Incentivo ao Desenvolvimento e Inovação da Indústria deInteligência Artificial (Fidia).;https://www.camara.leg.br/proposicoesWeb/prop_mostrarintegra?codteor=2416450;https://www.camara.leg.br/proposicoesWeb/fichadetramitacao?idProposicao=2430863;Criação, destinação, Recursos financeiros, Recursos públicos, incentivo, Investimento, expansão, Desenvolvimento tecnológico, Inovação tecnológica, Inteligência artificial.;Notificacao para Publicação Intermediária;2025-09-24;Tramitando em Conjunto;0.5733;PARCIAL (1 Termo);0.5916
PL 3783/2025;Projeto de Lei;2025-08-06;Prof. Reginaldo Veras;PV;Dispõe sobre a obrigatoriedade de advertências, recomendações etárias e limites de uso consciente de ferramentas de inteligência artificial, com foco na prevenção de danos à saúde mental, especialmente entre crianças, adolescentes e pessoas com transtornos mentais diagnosticados. Estabelece diretrizes para campanhas educativas, pesquisas públicas e responsabilização de desenvolvedores e provedores.;https://www.camara.leg.br/proposicoesWeb/prop_mostrarintegra?codteor=2967927;https://www.camara.leg.br/proposicoesWeb/fichadetramitacao?idProposicao=2541086;Obrigatoriedade, Plataforma digital, Internet, Software aplicativo, sistema de informação, escola, utilização, inteligência artificial, Classificação indicativa, faixa etária, proteção, saúde mental, criança, adolescente, Pessoa com transtorno mental, diretrizes.;Recebimento;2025-09-23;Tramitando em Conjunto;0.5732;TOTAL (2 Termos);0.4665
PL 390/2024;Projeto de Lei;2024-02-22;Camila Jara;PT;Altera a Lei nº 10.406 de 10 de janeiro de 2002 (Código Civil), para reconhecer como fraude anúncios de produtos falsos e golpes financeiros, que envolvam o uso manipulado por inteligência artificial da imagem e voz de pessoas.;https://www.camara.leg.br/proposicoesWeb/prop_mostrarintegra?codteor=2388831;https://www.camara.leg.br/proposicoesWeb/fichadetramitacao?idProposicao=2418485;Alteração, Código Civil (2002), Ato ilícito, fraude, Meio eletrônico, anúncio online, golpe financeiro, utilização, Inteligência artificial, diretrizes.;Saída de Relator(a) da Comissão - Com Parecer Apresentado;2025-03-19;Aguardando Designação de Relator(a);0.5727;TOTAL (2 Termos);0.4659
PL 842/2024;Projeto de Lei;2024-03-19;Ruy Carneiro;PODE;Altera a Lei no 12.965, de 23 de abril de 2014 (Marco Civil da Internet), para dispor sobre a obrigatoriedade de que aplicações de internet que se utilizem de mecanismos de inteligência artificial para a geração de conteúdos audiovisuais insiram sinalização nos conteúdos produzidos.;https://www.camara.leg.br/proposicoesWeb/prop_mostrarintegra?codteor=2396789;https://www.camara.leg.br/proposicoesWeb/fichadetramitacao?idProposicao=2421855;Alteração, Marco Civil da Internet (2014), obrigatoriedade, Aviso de alerta, Aplicação de internet, utilização, Inteligência artificial, Conteúdo audiovisual, Crime cibernético, Rede social digital;Recebimento;2024-03-25;Tramitando em Conjunto;0.5727;TOTAL (2 Termos);0.4659
PL 5694/2023;Projeto de Lei;2023-11-24;Fred Linhares;REPUBLICANOS;Criminaliza a manipulação ou adulteração de fotos, vídeos ou sons, utilizando-se de sistemas de inteligência artificial, com o intuito de causar constrangimento, humilhação, assédio, ameaça ou qualquer outro tipo de violência contra crianças ou adolescentes, além disso, aumenta a pena para crimes relacionados à pornografia infantil na hipótese de uso de inteligência artificial, se a cena de sexo explícito ou pornográfica envolvendo criança ou adolescente for manipulada ou adulterada por meio de sistema de inteligência artificial.;https://www.camara.leg.br/proposicoesWeb/prop_mostrarintegra?codteor=2364226;https://www.camara.leg.br/proposicoesWeb/fichadetramitacao?idProposicao=2406508;Alteração, Estatuto da Criança e do Adolescente (ECA), criminalização, manipulação, adulteração, fotografia, vídeo, som, utilização, inteligência artificial, intenção, provocação, constrangimento, humilhação, assédio moral, contra, criança, adolescente. _Aumento da pena, cena de sexo, cena pornográfica, envolvimento, criança, adolescente, manipulação, adulteração, realização, inteligência artificial.;Apresentação de Requerimento;2025-08-12;Aguardando Parecer;0.5693;TOTAL (2 Termos);0.4616
PL 2799/2025;Projeto de Lei;2025-06-10;Luiz Carlos Busato;UNIÃO;“Institui diretrizes para a prevenção do racismo algorítmico em sistemas automatizados de decisão utilizados por empresas, entidades do terceiro setor e órgãos públicos, e dá outras providências.”;https://www.camara.leg.br/proposicoesWeb/prop_mostrarintegra?codteor=2932317;https://www.camara.leg.br/proposicoesWeb/fichadetramitacao?idProposicao=2523759;Racismo, equidade, algoritmo, discriminação racial, sistema automático, automação, dados, tecnologia digital, tomada de decisão, inteligência artificial, direitos fundamentais, diretrizes.;Designação de Relator(a);2025-12-17;Aguardando Parecer;0.5655;TOTAL (2 Termos);0.4569
PL 4416/2025;Projeto de Lei;2025-09-03;Aureo Ribeiro;SOLIDARIEDADE;Altera a Lei nº 13.819, de 26 de abril de 2019, que institui a Política Nacional de Prevenção da Automutilação e do Suicídio, para instituir salvaguardas obrigatórias em sistemas de inteligência artificial.;https://www.camara.leg.br/proposicoesWeb/prop_mostrarintegra?codteor=2992652;https://www.camara.leg.br/proposicoesWeb/fichadetramitacao?idProposicao=2556998;Alteração, Política Nacional de Prevenção da Automutilação e do Suicídio, Lei Federal, obrigatoriedade, empresa, inteligência artificial generativa, critério, identificação, registro, notificação, referência, suicídio, automutilação, diretrizes.;Apensação;2025-11-10;Tramitando em Conjunto;0.5631;TOTAL (2 Termos);0.4539
PL 2462/2025;Projeto de Lei;2025-05-21;Ruy Carneiro;PODE;Veda o uso de ferramentas de inteligência artificial para a realização de dublagem de obras audiovisuais ofertadas comercialmente em salas de cinema, nas programações de televisão aberta e por assinatura e nos serviços de vídeo sob demanda e outras plataformas de distribuição de conteúdos audiovisuais pela internet.;https://www.camara.leg.br/proposicoesWeb/prop_mostrarintegra?codteor=2915975;https://www.camara.leg.br/proposicoesWeb/fichadetramitacao?idProposicao=2515281;Proibição, Inteligência artificial, dublagem, Obra audiovisual, cinema, televisão, Vídeo sob demanda, Plataforma de streaming.;Publicação de Proposição;2025-06-12;Aguardando Designação de Relator(a);0.5604;TOTAL (2 Termos);0.4505
PL 5005/2025;Projeto de Lei;2025-10-07;Lucas Ramos;PSB;Altera a Lei nº 9.610, de 19 de fevereiro de 1998, para dispor sobre a proteção da imagem, voz e demais características pessoais contra imitações digitais realistas geradas por inteligência artificial ou tecnologia similar, bem como reforça os direitos dos artistas intérpretes ou executantes.;https://www.camara.leg.br/proposicoesWeb/prop_mostrarintegra?codteor=3014749;https://www.camara.leg.br/proposicoesWeb/fichadetramitacao?idProposicao=2568007;Alteração, Lei dos Direitos Autorais (1998), proibição, fraude, representação, pessoa, voz humana, imagem, diretrizes, exceção, caricatura, paródia, sátira, crítica, jornalismo, atividade científica, atividade artística, ordem pública, instrução do processo, interesse público, consentimento, artista, intérprete, avanço tecnológico, tecnologia, inteligência artificial generativa, direito da personalidade, direito autoral, direito moral do autor, deepfake, conteúdo audiovisual, conteúdo digital.;Abertura de Prazo;2025-12-18;Aguardando Parecer;0.5595;TOTAL (2 Termos);0.4493
PL 5938/2023;Projeto de Lei;2023-12-08;Lídice da Mata;PSB;Altera a Lei 12.965, de 23 de abril e 2014, que estabelece princípios, garantias, direitos e deveres para o uso da Internet no Brasil, para prever que provedores de redes sociais adotem medidas para identificar e sinalizar conteúdos realizados com uso de inteligência artificial.;https://www.camara.leg.br/proposicoesWeb/prop_mostrarintegra?codteor=2373320;https://www.camara.leg.br/proposicoesWeb/fichadetramitacao?idProposicao=2411874;Alteração, Marco Civil da Internet (2014), obrigatoriedade, rede social digital, identificação, sinalização, produção, conteúdo digital, utilização, inteligência artificial, diretrizes.;Notificação de Apensação;2024-03-22;Tramitando em Conjunto;0.5562;TOTAL (2 Termos);0.4452
