Norma;Descricao da Sigla;Data de Apresentacao;Autor;Partido;Ementa;Link Documento PDF;Link Página Web;Indexacao;Último Estado;Data Último Estado;Situação;Score Final;Boost Keyword;Similaridade Semantica
PL 240/2020;Projeto de Lei;2020-02-11;Léo Moraes;PODE;Cria a Lei da Inteligência Artificial, e dá outras providências.;https://www.camara.leg.br/proposicoesWeb/prop_mostrarintegra?codteor=1857143;https://www.camara.leg.br/proposicoesWeb/fichadetramitacao?idProposicao=2236943;Criação, legislação, diretrizes, Inteligência artificial, segurança jurídica, investimento, pesquisa e desenvolvimento, produtos, serviços, tecnologia cognitiva, Política Nacional de Inteligência Artificial.;Desapensação;2021-09-29;Arquivada;0.9258;TOTAL (2 Termos);0.9072
PL 5303/2023;Projeto de Lei;2023-11-01;Renata Abreu;PODE;Dispõe sobre a prestação de serviços mediante o uso de inteligência artificial.;https://www.camara.leg.br/proposicoesWeb/prop_mostrarintegra?codteor=2354386;https://www.camara.leg.br/proposicoesWeb/fichadetramitacao?idProposicao=2400917;Requisito, utilização, inteligência artificial, prestação de serviços, pessoa física, pessoa jurídica, diretrizes.;Designação de Relator(a);2025-05-20;Aguardando Parecer;0.8811;TOTAL (2 Termos);0.8514
PL 759/2023;Projeto de Lei;2023-03-01;Lebrão;UNIÃO;Regulamenta os sistemas de Inteligência Artificial, e dá outras providências.;https://www.camara.leg.br/proposicoesWeb/prop_mostrarintegra?codteor=2238606;https://www.camara.leg.br/proposicoesWeb/fichadetramitacao?idProposicao=2349685;Regulamentação, Inteligência artificial, sistema computacional, parâmetro, segurança jurídica, investimento, pesquisa e desenvolvimento, desenvolvimento tecnológico, inovação, plataforma digital. _Inteligência artificial, diretrizes, criação, Política Nacional de Inteligência Artificial, tecnologia cognitiva.;Apresentação de Requerimento;2025-08-05;Aguardando Parecer;0.8219;TOTAL (2 Termos);0.7773
PL 897/2024;Projeto de Lei;2024-03-20;Saullo Vianna;UNIÃO;Dispõe sobre a Autenticação de Mídia Digital criada ou modificada por Inteligência Artificial (IA) e dá outras providências.;https://www.camara.leg.br/proposicoesWeb/prop_mostrarintegra?codteor=2397672;https://www.camara.leg.br/proposicoesWeb/fichadetramitacao?idProposicao=2422387;Obrigatoriedade, autenticação, Mídia digital, utilização, Inteligência Artificial, diretrizes.;Recebimento;2024-03-27;Tramitando em Conjunto;0.7868;TOTAL (2 Termos);0.7334
PL 762/2026;Projeto de Lei;2026-02-25;Rubens Pereira Júnior;PT;Estabelece marco regulatório para sistemas de inteligência artificial (IA) em setores de alta consequência e dá outras providências.;https://www.camara.leg.br/proposicoesWeb/prop_mostrarintegra?codteor=3088155;https://www.camara.leg.br/proposicoesWeb/fichadetramitacao?idProposicao=2604767;Alteração, Lei Geral de Proteção de Dados Pessoais (LGPDP) (2018), Marco Civil da Internet (2014), Código de Defesa do Consumidor (1990), sistema de inteligência artificial, domínio, alto risco, categorização, avaliação, impacto socioeconômico, direitos fundamentais, proteção, dados pessoais sensíveis, serviços essenciais, obrigatoriedade, certificação, registro público, governança de tecnologia da informação e comunicação, decisão automatizada, tratamento de dados, responsabilização, auditoria, transparência algorítmica, relações de consumo, diretrizes.;Apresentação de Proposição;2026-02-25;;0.7832;TOTAL (2 Termos);0.7290
PL 4719/2023;Projeto de Lei;2023-09-27;Dimas Gadelha;PT;Dispõe sobre o incentivo ao desenvolvimento de inteligência artificial.;https://www.camara.leg.br/proposicoesWeb/prop_mostrarintegra?codteor=2335296;https://www.camara.leg.br/proposicoesWeb/fichadetramitacao?idProposicao=2391466;Alteração, Lei de Informática (1991), Lei Federal, recursos, Fundo Nacional de Desenvolvimento Científico e Tecnológico (FNDCT), Fundo setorial, Fundo do Agronegócio (CT-Agronegócio), Fundo Aeronáutico (CT-Aeronáutico), Fundo de Biotecnologia (CT-Biotecnologia), Fundo de Energia (CT-Energ), Fundo Espacial (CT-Espacial), CT-Hidro, Fundo Inovar-Auto (CT-Inovar-Auto), CT-Saúde, investimento, Inteligência artificial.;Encerramento de Prazo;2025-10-08;Aguardando Parecer;0.7764;PARCIAL (1 Termo);0.8455
PL 1325/2025;Projeto de Lei;2025-03-31;Silvia Waiãpi;PL;Dispõe sobre a inserção do estudo de Inteligência Artificial na grade curricular do ensino fundamental e dá outras providências.;https://www.camara.leg.br/proposicoesWeb/prop_mostrarintegra?codteor=2875405;https://www.camara.leg.br/proposicoesWeb/fichadetramitacao?idProposicao=2491093;Obrigatoriedade, inclusão, ensino, conteúdo educativo, Inteligência artificial, grade curricular, instituição de ensino, educação básica, diretrizes.;Encerramento de Prazo;2025-06-26;Aguardando Parecer;0.7734;TOTAL (2 Termos);0.7167
PL 6237/2025;Projeto de Lei;2025-12-08;Poder Executivo;N/A;Institui o Sistema Nacional para Desenvolvimento, Regulação e Governança de Inteligência Artificial.;https://www.camara.leg.br/proposicoesWeb/prop_mostrarintegra?codteor=3063060;https://www.camara.leg.br/proposicoesWeb/fichadetramitacao?idProposicao=2594000;Criação, Sistema Nacional para Desenvolvimento, Regulação e Governança de Inteligência Artificial (SIA), regulamentação, Inteligência artificial, desenvolvimento tecnológico, segurança cibernética, Segurança de dados, preservação, direitos fundamentais, diretrizes.;Apresentação de Requerimento;2025-12-11;Aguardando Despacho do Presidente da Câmara dos Deputados (Chancela);0.7733;TOTAL (2 Termos);0.7167
PL 2338/2023;Projeto de Lei;2025-03-17;Senado Federal - Rodrigo Pacheco;N/A;Dispõe sobre o desenvolvimento, o fomento e o uso ético e responsável da inteligência artificial com base na centralidade da pessoa humana.;https://www.camara.leg.br/proposicoesWeb/prop_mostrarintegra?codteor=2868197;https://www.camara.leg.br/proposicoesWeb/fichadetramitacao?idProposicao=2487262;Diretrizes, desenvolvimento, incentivo, utilização, ética, inteligência artificial, direitos, pessoa, autorregulação, penalidade, competência, autoridade, Poder Público, critério, proteção, trabalho, trabalhador. _Alteração, Política Nacional de Educação Digital (PNED), inclusão, educação digital, instituição de ensino, letramento algorítmico, letramento crítico, inteligência artificial. _Alteração, lei federal, aplicação, recursos públicos, Fundo Nacional de Desenvolvimento Científico e Tecnológico (FNDCT), pesquisa, projeto (administração), inteligência artificial.;Aprovação de Requerimento;2026-02-11;Aguardando Parecer;0.7706;TOTAL (2 Termos);0.7132
PL 2129/2025;Projeto de Lei;2025-05-06;Nitinho;PSD;Dispõe sobre a obrigatoriedade de inclusão de conteúdos relacionados à inteligência artificial no currículo da educação básica.;https://www.camara.leg.br/proposicoesWeb/prop_mostrarintegra?codteor=2899204;https://www.camara.leg.br/proposicoesWeb/fichadetramitacao?idProposicao=2504671;Obrigatoriedade, inclusão, Currículo escolar, Disciplina (educação), Inteligência artificial, Educação básica.;Encerramento de Prazo;2025-07-02;Aguardando Parecer;0.7449;TOTAL (2 Termos);0.6811
PL 6326/2025;Projeto de Lei;2025-12-10;Marcos Tavares;PDT;Institui a Lei de Rotulagem de Conteúdo Sintético e de Transparência em Inteligência Artificial, dispondo sobre a obrigatoriedade de identificação de conteúdos gerados, manipulados ou alterados por sistemas de inteligência artificial, com vistas à proteção da informação, da democracia, do consumidor e dos direitos fundamentais no ambiente digital, e altera a Lei nº 12.965, de 23 de abril de 2014 (Marco Civil da Internet).;https://www.camara.leg.br/proposicoesWeb/prop_mostrarintegra?codteor=3065500;https://www.camara.leg.br/proposicoesWeb/fichadetramitacao?idProposicao=2595639;Regulamentação, Conteúdo sintético, Sistema de inteligência artificial, Confiança digital, Transparência algorítmica. _ Obrigatoriedade, Plataforma digital, rastreabilidade, identificação, rotulagem, conteúdo digital, Inteligência artificial generativa, Moderação de conteúdo, garantia, Direito à informação, Direito do consumidor. _ Alteração, Marco Civil da Internet (2014), Responsabilidade administrativa, Responsabilidade solidária, provedor de aplicações, internet.;Apresentação de Proposição;2025-12-10;Aguardando Despacho do Presidente da Câmara dos Deputados (Chancela);0.7429;TOTAL (2 Termos);0.6786
PL 4849/2024;Projeto de Lei;2024-12-11;Eduardo Bismarck;PDT;Estabelece fundamentos, princípios e diretrizes e a aplicação da Inteligência Artificial no Brasil.;https://www.camara.leg.br/proposicoesWeb/prop_mostrarintegra?codteor=2840632;https://www.camara.leg.br/proposicoesWeb/fichadetramitacao?idProposicao=2479396;Regulamentação, sistema de inteligência artificial, diretrizes, poder público.;Notificações;2025-07-08;Tramitando em Conjunto;0.7425;TOTAL (2 Termos);0.6781
PL 526/2025;Projeto de Lei;2025-02-18;Marx Beltrão;PP;DISPÕE SOBRE A REGULAÇÃO DO USO DA INTELIGÊNCIA ARTIFICIAL NO BRASIL E DÁ OUTRAS PROVIDÊNCIAS.;https://www.camara.leg.br/proposicoesWeb/prop_mostrarintegra?codteor=2857071;https://www.camara.leg.br/proposicoesWeb/fichadetramitacao?idProposicao=2484379;Regulação, inteligência artificial, Brasil, diretrizes, sistema de inteligência artificial.;Recebimento;2025-03-25;Tramitando em Conjunto;0.7419;TOTAL (2 Termos);0.6774
PL 1153/2023;Projeto de Lei;2023-03-15;Carlos Henrique Gaguim;UNIÃO;Dispõe sobre normas gerais para a pesquisa, o desenvolvimento e a aplicação da inteligência artificial - IA, e seu uso consciente e ético no âmbito da União, dos Estados, do Distrito Federal e dos Municípios.;https://www.camara.leg.br/proposicoesWeb/prop_mostrarintegra?codteor=2243580;https://www.camara.leg.br/proposicoesWeb/fichadetramitacao?idProposicao=2351386;Norma geral, pesquisa e desenvolvimento, aplicação, Inteligência artificial, utilização, Inteligência artificial, âmbito, União, estado (ente federado), Distrito Federal (Brasil). _Criação, Centro Nacional de Inteligência Artificial, vinculação, Ministério da Ciência, Tecnologia e Inovação, finalidade, desenvolvimento, coordenação, política pública, programa (administração), projeto (administração), incentivo, pesquisa e desenvolvimento, inteligência artificial. _Utilização, inteligência artificial, administração pública, princípios, critério técnico, dados científicos. _Estado (ente federado), Distrito Federal, município, criação, legislação suplementar, realização, convênio, parceria público-privada.;Publicação de Proposição;2023-04-24;Tramitando em Conjunto;0.7395;TOTAL (2 Termos);0.6744
PL 897/2025;Projeto de Lei;2025-03-11;Helio Lopes;PL;Institui a Lei de Incentivo à Pesquisa em Inteligência Artificial com Recursos das Apostas e Jogos Lotéricos;https://www.camara.leg.br/proposicoesWeb/prop_mostrarintegra?codteor=2865102;https://www.camara.leg.br/proposicoesWeb/fichadetramitacao?idProposicao=2486481;Criação, Ação governamental, destinação, Recursos financeiros, Aposta esportiva, Jogo online, incentivo, Pesquisa científica, Pesquisa acadêmica, Inteligência artificial,;Saída de Relator(a) da Comissão - Sem Parecer Apresentado;2026-02-03;Aguardando Designação - Aguardando Devolução de Relator(a) que deixou de ser Membro;0.7350;TOTAL (2 Termos);0.6688
PL 3782/2025;Projeto de Lei;2025-08-06;Prof. Reginaldo Veras;PV;Dispõe sobre a vedação da substituição de profissionais humanos por sistemas de inteligência artificial em atividades que exigem vínculo interpessoal direto, e dá outras providências.;https://www.camara.leg.br/proposicoesWeb/prop_mostrarintegra?codteor=2967926;https://www.camara.leg.br/proposicoesWeb/fichadetramitacao?idProposicao=2541085;Proibição, substituição, pessoa humana, Inteligência artificial, atividade profissional, Terapia ocupacional, assistência social, psicologia, psiquiatria, professor, Fonoaudiologia, fisioterapia, enfermagem, conselho tutelar, exigência, Relações interpessoais, diretrizes.;Recebimento;2025-09-23;Tramitando em Conjunto;0.7255;TOTAL (2 Termos);0.6569
PL 83/2026;Projeto de Lei;2026-02-02;Pastor Henrique Vieira;PSOL;Dispõe sobre a identificação obrigatória de conteúdos gerados ou manipulados por inteligência artificial, estabelece responsabilidade objetiva das plataformas digitais e tipifica condutas relacionadas à difusão de deepfakes.;https://www.camara.leg.br/proposicoesWeb/prop_mostrarintegra?codteor=3076637;https://www.camara.leg.br/proposicoesWeb/fichadetramitacao?idProposicao=2600154;Obrigatoriedade, Plataforma digital, usuário, rede social digital, identificação, conteúdo digital, inteligência artificial, proibição, publicação, Deepfake.;Apresentação de Proposição;2026-02-02;Aguardando Autorização do Despacho;0.7226;TOTAL (2 Termos);0.6533
PL 2008/2024;Projeto de Lei;2024-05-22;Vinicius Carvalho;REPUBLICANOS;Dispõe sobre a prevenção e repressão às infrações contra a ordem econômica através do uso de Inteligência Artificial (IA) para efetuar práticas desleais de concorrência.;https://www.camara.leg.br/proposicoesWeb/prop_mostrarintegra?codteor=2427972;https://www.camara.leg.br/proposicoesWeb/fichadetramitacao?idProposicao=2435976;Alteração, Lei de Defesa da Concorrência (2011), Infração contra a ordem econômica, utilização, Inteligência artificial, Concorrência desleal.;Publicação de Proposição;2024-06-20;Tramitando em Conjunto;0.7175;TOTAL (2 Termos);0.6469
PL 1893/2025;Projeto de Lei;2025-04-28;Rogéria Santos;REPUBLICANOS;Institui o Programa Nacional de Prevenção e Combate ao Estelionato Digital com o uso de algoritmos e inteligência artificial, e dá outras providências.;https://www.camara.leg.br/proposicoesWeb/prop_mostrarintegra?codteor=2892590;https://www.camara.leg.br/proposicoesWeb/fichadetramitacao?idProposicao=2500774;Criação, Programa Nacional de Prevenção e Combate ao Estelionato Digital (PROALGODIGITAL), regulação, utilização, Big data, Algoritmo, inteligência artificial, prevenção, Crime cibernético, fraude eletrônica.;Designação de Relator(a);2026-02-11;Aguardando Parecer;0.7099;TOTAL (2 Termos);0.6373
PL 4455/2025;Projeto de Lei;2025-09-04;Maurício Carvalho;UNIÃO;Altera a Lei nº 14.533, de 11 de janeiro de 2023, que institui a Política Nacional de Educação Digital e dá outras providências, para dispor sobre desenvolvimento de competências para o uso inteligência artificial.;https://www.camara.leg.br/proposicoesWeb/prop_mostrarintegra?codteor=2993539;https://www.camara.leg.br/proposicoesWeb/fichadetramitacao?idProposicao=2557405;Alteração, Política Nacional de Educação Digital (PNED), inclusão, prioridade, estratégia (administração), educação digital, desenvolvimento, competência, aluno, educação básica, responsabilidade, utilização, inteligência artificial generativa.;Recebimento;2025-10-06;Tramitando em Conjunto;0.7094;TOTAL (2 Termos);0.6367
PL 1969/2021;Projeto de Lei;2021-05-26;Gustavo Fruet;PDT;Dispõe sobre os princípios, direitos e obrigações na utilização de sistemas de inteligência artificial.;https://www.camara.leg.br/proposicoesWeb/prop_mostrarintegra?codteor=2018899;https://www.camara.leg.br/proposicoesWeb/fichadetramitacao?idProposicao=2284814;Princípios, direitos, obrigações, Utilização, Inteligência artificial.;Desapensação;2021-09-29;Arquivada;0.7041;PARCIAL (1 Termo);0.7551
PL 1797/2024;Projeto de Lei;2024-05-14;Dr. Allan Garcês;PP;Estabelece normas gerais para o desenvolvimento, implementação e uso responsável de sistemas de Inteligência Artificial, com o objetivo de proteger os direitos humanos e a garantia de sistemas seguros e confiáveis em benefício da pessoa humana.;https://www.camara.leg.br/proposicoesWeb/prop_mostrarintegra?codteor=2422876;https://www.camara.leg.br/proposicoesWeb/fichadetramitacao?idProposicao=2433206;Diretrizes, uso seguro, Inteligência artificial, sistema de informação, confiabilidade, proteção, direitos humanos. _Alteração, Lei Geral de Proteção de Dados Pessoais (LGPDP) (2018), competência, Autoridade Nacional de Proteção de Dados (ANPD). _Criação, Conselho Nacional sobre Inteligência Artificial.;Notificações;2025-07-08;Tramitando em Conjunto;0.6987;TOTAL (2 Termos);0.6234
PL 1963/2025;Projeto de Lei;2025-04-29;Marcos Tavares;PDT;Dispõe sobre a inclusão obrigatória do tema Inteligência Artificial nos currículos do ensino fundamental II e do ensino médio em todas as redes de ensino do país e dá outras providências.;https://www.camara.leg.br/proposicoesWeb/prop_mostrarintegra?codteor=2895425;https://www.camara.leg.br/proposicoesWeb/fichadetramitacao?idProposicao=2502776;Critério, obrigatoriedade, inclusão, currículo escolar, ensino fundamental, ensino médio, conteúdo educativo, inteligência artificial, diretrizes.;Encerramento de Prazo;2025-07-02;Aguardando Parecer;0.6957;TOTAL (2 Termos);0.6197
PL 6248/2025;Projeto de Lei;2025-12-09;Coronel Chrisóstomo;PL;Dispõe sobre a utilização de sistemas de inteligência artificial nas atividades de análise de inteligência policial, estabelecendo princípios éticos, definições técnicas, limites de uso, diretrizes para supervisão humana e autoriza o uso de IA na análise de comunicações legalmente interceptadas.;https://www.camara.leg.br/proposicoesWeb/prop_mostrarintegra?codteor=3063479;https://www.camara.leg.br/proposicoesWeb/fichadetramitacao?idProposicao=2594273;Utilização, Inteligência artificial, análise, Inteligência policial, diretrizes.;Apresentação de Proposição;2025-12-09;Aguardando Chancela e Publicação do Despacho;0.6930;TOTAL (2 Termos);0.6162
PL 899/2025;Projeto de Lei;2025-03-11;Helio Lopes;PL;Institui a Lei de Inclusão Digital e Desenvolvimento de Habilidades Educacionais com Inteligência Artificial no Brasil e dá outras providências.;https://www.camara.leg.br/proposicoesWeb/prop_mostrarintegra?codteor=2865105;https://www.camara.leg.br/proposicoesWeb/fichadetramitacao?idProposicao=2486483;Criação, Lei de Inclusão Digital e Desenvolvimento de Habilidades Educacionais com Inteligência Artificial no Brasil, destinação, recursos públicos, Fundo de Manutenção e Desenvolvimento da Educação Básica e de Valorização dos Profissionais da Educação (Fundeb), promoção, inclusão digital, utilização, tecnologia, inteligência artificial, ensino, aprendizagem, diretrizes.;Encerramento de Prazo;2025-06-12;Aguardando Parecer;0.6922;TOTAL (2 Termos);0.6153
PL 6663/2025;Projeto de Lei;2025-12-22;Amom Mandel;CIDADANIA;Cria o Selo Empresa Transparente em Inteligência Artificial, certificando organizações que adotem práticas claras, éticas e auditáveis no uso de algoritmos.;https://www.camara.leg.br/proposicoesWeb/prop_mostrarintegra?codteor=3071689;https://www.camara.leg.br/proposicoesWeb/fichadetramitacao?idProposicao=2599040;Criação, incentivo, Governança, Ética digital, Ética profissional, Selo de certificação, Empresa, utilização, Inteligência artificial, Algoritmo, Transparência algorítmica, Decisão automatizada, Tecnologia, diretrizes.;Recebimento;2026-02-13;Aguardando Designação de Relator(a);0.6876;TOTAL (2 Termos);0.6096
PL 21/2020;Projeto de Lei;2020-02-04;Eduardo Bismarck;PDT;"Estabelece princípios, direitos e deveres para o uso de inteligência artificial no Brasil, e dá outras providências.

NOVA EMENTA: Estabelece fundamentos, princípios e diretrizes para o desenvolvimento e a aplicação da inteligência artificial no Brasil; e dá outras providências.";https://www.camara.leg.br/proposicoesWeb/prop_mostrarintegra?codteor=1853928;https://www.camara.leg.br/proposicoesWeb/fichadetramitacao?idProposicao=2236340;Criação, princípios, direitos, deveres, meios, governança, utilização, inteligência artificial, diretrizes, atuação, União, estado (ente federado), Distrito Federal (Brasil), município, pessoa física, pessoa jurídica.;Arquivamento;2025-01-20;Arquivada;0.6857;TOTAL (2 Termos);0.6071
PL 705/2022;Projeto de Lei;2022-03-24;Helio Lopes;PL;Dispõe sobre a compatibilização dos sistemas de Inteligência Artificial utilizados pela Administração Pública a práticas da agenda ambiental, social e de governança.;https://www.camara.leg.br/proposicoesWeb/prop_mostrarintegra?codteor=2152436;https://www.camara.leg.br/proposicoesWeb/fichadetramitacao?idProposicao=2318674;Compatibilização, sistema computacional, inteligência artificial, Administração direta, Administração indireta, boas práticas, meio ambiente, ambiente social, governança. _Finalidade, promoção, desenvolvimento econômico,  desenvolvimento sustentável, respeito, pluralidade, diversidade, garantia, utilização, meios, governança, fundamentação, transparência, ética, colaboração.;Arquivamento;2024-12-10;Arquivada;0.6835;TOTAL (2 Termos);0.6044
PL 4589/2024;Projeto de Lei;2024-11-28;Coronel Chrisóstomo;PL;Institui o Sistema de Assistência Automática por Inteligência Artificial (AAIA) para integração aos cadastros sociais, com o objetivo de otimizar a análise de dados e oferecer suporte imediato a famílias em situação de vulnerabilidade.;https://www.camara.leg.br/proposicoesWeb/prop_mostrarintegra?codteor=2828907;https://www.camara.leg.br/proposicoesWeb/fichadetramitacao?idProposicao=2473135;Criação, Sistema computacional, Inteligência artificial, integração, Cadastro Único para Programas Sociais do Governo Federal (CadÚnico), antecipação, Tecnologia cognitiva, Assistência social, Proteção social.;Saída de Relator(a) da Comissão - Sem Parecer Apresentado;2026-02-03;Aguardando Designação - Aguardando Devolução de Relator(a) que deixou de ser Membro;0.6808;TOTAL (2 Termos);0.6010
PL 1614/2025;Projeto de Lei;2025-04-09;Zé Neto;PT;Altera a Lei nº 14.533, de 11 de janeiro de 2023, para dispor sobre a inclusão de aspectos relacionados à inteligência artificial, à segurança na rede e à proteção de dados pessoais na formação continuada dos profissionais da educação.;https://www.camara.leg.br/proposicoesWeb/prop_mostrarintegra?codteor=2883999;https://www.camara.leg.br/proposicoesWeb/fichadetramitacao?idProposicao=2496418;Alteração, Política Nacional de Educação Digital (PNED), inclusão, Conteúdo programático, Tecnologia digital, Educação continuada, Inteligência artificial, Segurança de dados, Profissional da educação.;Apresentação de Requerimento;2025-10-13;Aguardando Designação de Relator(a);0.6768;TOTAL (2 Termos);0.5960
PL 5859/2023;Projeto de Lei;2023-12-05;Felipe Francischini;UNIÃO;Proíbe o uso de Aplicativos e Programas de Inteligência Artificial para criação de “Deep Nudes” e dá outras providências.;https://www.camara.leg.br/proposicoesWeb/prop_mostrarintegra?codteor=2369677;https://www.camara.leg.br/proposicoesWeb/fichadetramitacao?idProposicao=2409286;Proibição, desenvolvimento, distribuição, venda, promoção, utilização, aplicativo, inteligência artificial, deep nude. _Desobediência, infração, sanção, multa.;Recebimento;2025-06-23;Tramitando em Conjunto;0.6755;TOTAL (2 Termos);0.5943
PL 1522/2024;Projeto de Lei;2024-05-02;Julio Lopes;PP;Dispõe sobre a utilização de ferramentas tecnológicas de inteligência artificial para gestão e manutenção de dados no Sistema Único de Saúde em todo território nacional;https://www.camara.leg.br/proposicoesWeb/prop_mostrarintegra?codteor=2416098;https://www.camara.leg.br/proposicoesWeb/fichadetramitacao?idProposicao=2430744;Regulamentação, utilização, Inteligência artificial, gestão, manutenção, Sistema Único de Saúde (SUS), Inovação tecnológica, identificação, cadastro, Usuário, condição específica, Leilão reverso.;Encerramento de Prazo;2025-05-27;Pronta para Pauta;0.6729;TOTAL (2 Termos);0.5912
PL 5324/2025;Projeto de Lei;2025-10-21;Dimas Gadelha;PT;Altera o Marco Civil da Internet - Lei nº 12.965, de 23 de abril de 2014, para obrigar a identificação de conteúdo gerado por inteligência artificial.;https://www.camara.leg.br/proposicoesWeb/prop_mostrarintegra?codteor=3026018;https://www.camara.leg.br/proposicoesWeb/fichadetramitacao?idProposicao=2574067;Alteração, Marco Civil da Internet (2014), obrigatoriedade, identificação, conteúdo informativo, conteúdo digital, inteligência artificial, provedor de aplicações, internet.;Apresentação de Proposição;2025-10-21;Aguardando Despacho do Presidente da Câmara dos Deputados (Chancela);0.6715;TOTAL (2 Termos);0.5894
PL 3003/2025;Projeto de Lei;2025-06-23;Prof. Reginaldo Veras;PV;Dispõe sobre a vedação da substituição de docentes por sistemas de inteligência artificial na educação básica e no ensino superior.;https://www.camara.leg.br/proposicoesWeb/prop_mostrarintegra?codteor=2939361;https://www.camara.leg.br/proposicoesWeb/fichadetramitacao?idProposicao=2527320;Proibição, substituição, professor, educação básica, educação superior, inteligência artificial, critério.;Publicação de Proposição;2025-12-22;Aguardando Designação de Relator(a);0.6707;TOTAL (2 Termos);0.5884
