Norma;Descricao da Sigla;Data de Apresentacao;Autor;Partido;Ementa;Link Documento PDF;Link Página Web;Indexacao;Último Estado;Data Último Estado;Situação;Score Final;Boost Keyword;Similaridade Semantica
PL 428/2026;Projeto de Lei;2026-02-10;Chris Tonietto;PL;Altera o § 2º-A do art. 171 do Decreto-Lei nº 2.848, de 7 de dezembro de 1940 (Código Penal), passando a prever como modalidade de fraude eletrônica aquela cometida mediante uso de imagens, vídeos ou áudios gerados por inteligência artificial.;https://www.camara.leg.br/proposicoesWeb/prop_mostrarintegra?codteor=3080829;https://www.camara.leg.br/proposicoesWeb/fichadetramitacao?idProposicao=2601941;Alteração, Código Penal (1940), crime contra o patrimônio, tipificação de conduta, tipicidade penal, fraude eletrônica, estelionato, obtenção, dados pessoais, ambiente virtual, persuasão (psicologia), vítima, rede social digital, conteúdo digital, inteligência artificial generativa.;Apresentação de Proposição;2026-02-10;;0.5554;TOTAL (2 Termos);0.4442
PL 5548/2025;Projeto de Lei;2025-10-30;Wellington Roberto;PL;Altera a Lei nº 13.709, de 14 de agosto de 2018 (Lei Geral de Dados Pessoais – LGPD), disciplinando o tratamento de dados preditivos de saúde por sistemas de inteligência artificial e congêneres.;https://www.camara.leg.br/proposicoesWeb/prop_mostrarintegra?codteor=3035106;https://www.camara.leg.br/proposicoesWeb/fichadetramitacao?idProposicao=2579218;Alteração, Lei Geral de Proteção de Dados Pessoais (LGPDP) (2018), Tratamento de dados, Dados pessoais sensíveis, Prontuário médico, Inteligência artificial, Algoritmo, cálculo, Probabilidade e Estatística, Doença, fator de risco, Operadora de plano de assistência à saúde, Instituição financeira, Empregador.;Apresentação de Requerimento;2026-02-23;Aguardando Parecer;0.5539;TOTAL (2 Termos);0.4424
PL 3488/2024;Projeto de Lei;2024-09-09;Alexandre Guimarães;MDB;Altera a Lei nº 12.965, de 23 de abril de 2014 e o Decreto-Lei nº 2.848, de 7 de dezembro de 1940 (Código Penal), no intuito de coibir a criação e divulgação de falso vídeo ou imagem sexualmente explícita e não consensual, produzido por meio de inteligência artificial.;https://www.camara.leg.br/proposicoesWeb/prop_mostrarintegra?codteor=2474480;https://www.camara.leg.br/proposicoesWeb/fichadetramitacao?idProposicao=2457308;Alteração, Marco Civil da Internet (2014), Código Penal (1940), proibição, criação, divulgação, imagem íntima, vídeo íntimo, inteligência artificial, deepfake, deep nude, responsabilidade, provedor de aplicações, internet, remoção de conteúdo, campanha educativa, proteção, vítima, diretrizes, Exposição de intimidade sexual, Registro não autorizado da intimidade sexual, aumento da pena.;Publicação de Proposição;2025-05-15;Aguardando Designação de Relator(a);0.5508;TOTAL (2 Termos);0.4385
PL 453/2026;Projeto de Lei;2026-02-10;Pastor Sargento Isidório;AVANTE;Estabelece a obrigatoriedade de inserção de selo, marca d’água ou aviso visível em vídeos, imagens, áudios e demais conteúdos digitais produzidos total ou parcialmente por sistemas de Inteligência Artificial e veiculados no Brasil, inclusive em redes sociais, plataformas digitais e aplicativos de mensagens, com o objetivo de prevenir a desinformação, proteger a honra, a imagem, a privacidade dos cidadãos e coibir usos nocivos da tecnologia e dá outras providências.;https://www.camara.leg.br/proposicoesWeb/prop_mostrarintegra?codteor=3081317;https://www.camara.leg.br/proposicoesWeb/fichadetramitacao?idProposicao=2602287;Obrigatoriedade, marcação, aviso, identificação, vídeo, imagem, som, conteúdo digital, utilização, inteligência artificial generativa, diretrizes.;Apresentação de Proposição;2026-02-10;;0.5503;TOTAL (2 Termos);0.4379
PL 5641/2023;Projeto de Lei;2023-11-22;Fernanda Melchionna;PSOL;Dispõe sobre a proibição de aplicativos, sites, ferramentas e similares que utilizam inteligência artificial para criação de imagens pornográficas não autorizadas com o rosto de mulheres, bem como estabelece medidas para prevenir e combater a disseminação dessas imagens.;https://www.camara.leg.br/proposicoesWeb/prop_mostrarintegra?codteor=2362641;https://www.camara.leg.br/proposicoesWeb/fichadetramitacao?idProposicao=2405761;Proibição, sítio (internet), software aplicativo, ferramenta digital, utilização, inteligência artificial, edição, imagem, vídeo, material erótico, conteúdo sexual, ausência, consentimento, pessoa, criação, distribuição. _Medida de prevenção, combate, disseminação, imagem. _Violação, proibição, aplicação, multa.;Recebimento;2025-06-23;Tramitando em Conjunto;0.5468;TOTAL (2 Termos);0.4335
PL 5695/2023;Projeto de Lei;2023-11-24;Fred Linhares;REPUBLICANOS;Tipifica penalmente a alteração de fotos, vídeos e som com o uso de sistema de Inteligência Artificial para praticar violência contra a mulher.;https://www.camara.leg.br/proposicoesWeb/prop_mostrarintegra?codteor=2364235;https://www.camara.leg.br/proposicoesWeb/fichadetramitacao?idProposicao=2406516;Alteração, Lei Maria da Penha, tipicidade penal, Crime de Manipulação e Adulteração de Fotos e Vídeos com o Uso de Sistema de Inteligência Artificial, manipulação, adulteração, fotografia, vídeo, som, utilização, Inteligência artificial, prática, violência, contra, mulher, pena.;Parecer do(a) Relator(a);2025-10-15;Pronta para Pauta;0.5440;TOTAL (2 Termos);0.4299
PL 7137/2025;Projeto de Lei;2025-12-22;Amom Mandel;CIDADANIA;Altera a Lei nº 9.394, de 20 de dezembro de 1996 (Lei de Diretrizes e Bases da Educação Nacional), para incluir a literacia e cidadania digital, com ênfase em Inteligência Artificial, como tema transversal na educação básica e superior da rede pública de ensino.;https://www.camara.leg.br/proposicoesWeb/prop_mostrarintegra?codteor=3072678;https://www.camara.leg.br/proposicoesWeb/fichadetramitacao?idProposicao=2599746;Alteração, Lei de Diretrizes e Bases da Educação Nacional (1996), inclusão, currículo escolar, conteúdo educativo, Inteligência artificial generativa, inclusão digital.;Apresentação de Proposição;2025-12-22;Aguardando Despacho do Presidente da Câmara dos Deputados (Chancela);0.5425;TOTAL (2 Termos);0.4281
PL 3236/2024;Projeto de Lei;2024-08-20;Júnior Mano;PSB;Dispõe sobre a proteção dos direitos de propriedade intelectual dos atletas, regulamentando o registro e a exploração de movimentos esportivos, marcas pessoais, o uso da imagem dos atletas para fins comerciais e o uso de Inteligência Artificial no contexto esportivo, e dá outras providências.;https://www.camara.leg.br/proposicoesWeb/prop_mostrarintegra?codteor=2467213;https://www.camara.leg.br/proposicoesWeb/fichadetramitacao?idProposicao=2454171;Diretrizes, proteção, direito de propriedade intelectual, direito autoral, atleta, regulamentação, registro, exploração, comercialização, utilização, inteligência artificial, esporte, setor esportivo, Instituto Nacional da Propriedade Industrial (INPI).;Encerramento de Prazo;2025-08-07;Aguardando Parecer;0.5415;TOTAL (2 Termos);0.4268
PL 2721/2024;Projeto de Lei;2024-07-03;Jonas Donizette;PSB;Altera o art. 11 da Lei n° 9.610, de 1998, para deixar expresso que autor é apenas a pessoa física, independentemente do grau de autonomia do sistema de inteligência artificial utilizado na elaboração da obra.;https://www.camara.leg.br/proposicoesWeb/prop_mostrarintegra?codteor=2446536;https://www.camara.leg.br/proposicoesWeb/fichadetramitacao?idProposicao=2445849;Alteração, Lei dos Direitos Autorais (1998), garantia, direito autoral, pessoa física, obra intelectual, independência, Sistema de inteligência artificial.;Retirada de Pauta;2025-11-19;Pronta para Pauta;0.5395;PARCIAL (1 Termo);0.5493
PL 5792/2025;Projeto de Lei;2025-11-11;Marcos Tavares;PDT;Institui a Lei Nacional de Observatórios de Transparência em Licitações com Inteligência Artificial (IA), para auditoria automatizada e contínua de editais, contratos e processos licitatórios no âmbito da administração pública direta e indireta, e dá outras providências.;https://www.camara.leg.br/proposicoesWeb/prop_mostrarintegra?codteor=3044180;https://www.camara.leg.br/proposicoesWeb/fichadetramitacao?idProposicao=2583785;Criação, Lei Nacional de Observatórios de Transparência em Licitações com Inteligência Artificial - IA, auditoria, tempo real, utilização, inteligência artificial, edital, contrato administrativo, licitação, administração pública, diretrizes.;Publicação de Proposição;2026-02-02;Aguardando Designação de Relator(a);0.5335;TOTAL (2 Termos);0.4169
PL 645/2015;Projeto de Lei;2015-03-10;Raul Jungmann;PPS;"Altera o Art. 6º da Lei nº 9.883, de 7 de dezembro de 1999, que ""Institui o Sistema Brasileiro de Inteligência - ABIN, e dá outras providências"",  para criar a Controladoria das Atividades de Inteligência.";https://www.camara.leg.br/proposicoesWeb/prop_mostrarintegra?codteor=1307647;https://www.camara.leg.br/proposicoesWeb/fichadetramitacao?idProposicao=994679;Alteração, Lei da ABIN, criação, Controladoria das Atividades de Inteligência, objetivo, fiscalização, atividade de inteligência.;Notificações;2024-07-19;Tramitando em Conjunto;0.5334;PARCIAL (1 Termo);0.5417
PL 3821/2024;Projeto de Lei;2024-10-07;Amanda Gentil;PP;Altera o Decreto-Lei nº 2.848, de 7 de dezembro de 1940 (Código Penal), e a Lei nº 9.504, de 30 de setembro de 1997 (Lei das Eleições), para tipificar o crime de manipulação digital de imagens por inteligência artificial, e agravar a pena em casos de crimes contra mulheres e candidaturas em período eleitoral, e dá outras providências.;https://www.camara.leg.br/proposicoesWeb/prop_mostrarintegra?codteor=2482757;https://www.camara.leg.br/proposicoesWeb/fichadetramitacao?idProposicao=2461213;Alteração, Código Penal (1940), Lei das Eleições (1997), exposição de intimidade sexual, tipificação penal, tratamento de imagem, inteligência artificial, pornografia falsa (porno fake), deep nude, intimidação, retaliação, constrangimento, aumento da pena, vítima, mulher, publicação, rede social, Plataforma digital, Ação penal pública incondicionada, proibição, inteligência artificial, Conteúdo sexual, Candidato a cargo eletivo, aumento da pena, vítima, candidata, mulher, crime eleitoral.;Expedição de Documento;2025-02-26;Aguardando Apreciação pelo Senado Federal;0.5320;TOTAL (2 Termos);0.4151
PL 2807/2024;Projeto de Lei;2024-07-09;Júnior Mano;PSB;Dispõe sobre a proteção da imagem de crianças, proibindo a utilização de suas fotos para alimentar ferramentas de inteligência artificial sem o consentimento expresso de seus pais ou representantes legais.;https://www.camara.leg.br/proposicoesWeb/prop_mostrarintegra?codteor=2452315;https://www.camara.leg.br/proposicoesWeb/fichadetramitacao?idProposicao=2448043;Alteração, Estatuto da Criança e do Adolescente (ECA) (1990), Proibição, imagem, Fotografia, criança, adolescente, sistema de inteligência artificial, ausência, autorização, pais, responsável legal, configuração, Crime contra a criança e o adolescente, reclusão, multa.;Publicação de Proposição;2025-04-28;Aguardando Designação de Relator(a);0.5285;TOTAL (2 Termos);0.4106
PL 5394/2023;Projeto de Lei;2023-11-07;Erika Kokay;PT;Altera o Decreto-Lei nº 2.848, de 7 de dezembro de 1940, Código Penal, para criminalizar a adulteração, montagem ou modificação de fotografia, vídeo ou qualquer outra forma de representação visual relativos à intimidade da pessoa, por meio de Inteligência Artificial, e dá outras providências.;https://www.camara.leg.br/proposicoesWeb/prop_mostrarintegra?codteor=2356559;https://www.camara.leg.br/proposicoesWeb/fichadetramitacao?idProposicao=2402162;Alteração, Código Penal (1940), tipificação de conduta, crime, pornografia falsa (porno fake), criação, oferecimento, troca, disponibilização, transmissão, distribuição, publicação, divulgação, dispositivo informático, telemática, fotografia, vídeo, pessoa, cena de sexo, nudez, inteligência artificial, pena.;Notificacao para Publicação Intermediária;2025-10-06;Tramitando em Conjunto;0.5283;TOTAL (2 Termos);0.4104
PL 212/2026;Projeto de Lei;2026-02-03;Rubens Pereira Júnior;PT;Criminaliza a produção e a disseminação de conteúdo audiovisual, sonoro ou visual gerado ou manipulado por inteligência artificial (deepfakes) e dá outras providências.;https://www.camara.leg.br/proposicoesWeb/prop_mostrarintegra?codteor=3078129;https://www.camara.leg.br/proposicoesWeb/fichadetramitacao?idProposicao=2600618;Alteração, Código Eleitoral (1965), tipificação de conduta, tipicidade penal, crime eleitoral, propaganda eleitoral irregular, produção, divulgação, produto audiovisual, deepfake, notícia falsa (fake news), desinformação, inteligência artificial, investigação criminal. _Alteração, Marco Civil da Internet (2014), responsabilidade civil, provedor de aplicações, obrigatoriedade, remoção de conteúdo, conteúdo digital, descumprimento, penalidade administrativa. _Alteração, Lei Geral de Proteção de Dados Pessoais (LGPDP) (2018), compartilhamento de dados, garantia, proteção, sigilo, dados pessoais.;Apresentação de Proposição;2026-02-03;Aguardando Despacho do Presidente da Câmara dos Deputados;0.5203;TOTAL (2 Termos);0.4004
PL 4348/2025;Projeto de Lei;2025-09-01;Pedro Campos;PSB;Altera a Lei nº 13.819, de 26 de abril de 2019, para incluir a obrigatoriedade de emissão de alertas preventivos por chatbots e sistemas de inteligência artificial em interações relacionadas à saúde mental, automutilação ou suicídio.;https://www.camara.leg.br/proposicoesWeb/prop_mostrarintegra?codteor=2989901;https://www.camara.leg.br/proposicoesWeb/fichadetramitacao?idProposicao=2555351;Alteração, Lei Federal, obrigatoriedade, Plataforma digital, Chatbot, Sistema de inteligência artificial, Aviso de alerta, interação, usuário, conteúdo digital, saúde mental, Automutilação, suicídio,;Notificação de Apensação;2025-11-10;Aguardando Parecer;0.5136;TOTAL (2 Termos);0.3920
PL 4323/2025;Projeto de Lei;2025-08-29;Delegado Bruno Lima;PP;Altera a Lei nº 8.069, de 13 de julho de 1990 (Estatuto da Criança e do Adolescente), para tipificar o crime de aliciamento cibernético em tempo real e agravar penas para a utilização de inteligência artificial na produção de material de exploração sexual infantil.;https://www.camara.leg.br/proposicoesWeb/prop_mostrarintegra?codteor=2988838;https://www.camara.leg.br/proposicoesWeb/fichadetramitacao?idProposicao=2554834;Alteração, Estatuto da Criança e do Adolescente (ECA) (1990), tipificação de conduta, Aliciamento de menores, produção, conteúdo sexual, Ambiente virtual, exploração sexual, Inteligência artificial, Deepfake, enfrentamento, pornografia infantil, Adultização de crianças e adolescentes.;Apresentação de Requerimento;2025-10-02;Aguardando análise do Presidente da Câmara - (Decisão);0.5066;TOTAL (2 Termos);0.3832
PL 477/2024;Projeto de Lei;2024-02-28;Saullo Vianna;UNIÃO;Tipifica na lei penal a alteração de fotos, vídeos e som com o uso de sistema de Inteligência Artificial para praticar violência contra a mulher.;https://www.camara.leg.br/proposicoesWeb/prop_mostrarintegra?codteor=2390112;https://www.camara.leg.br/proposicoesWeb/fichadetramitacao?idProposicao=2418795;Alteração, Código Penal (1940), Exposição de intimidade sexual, tipicidade penal, Tratamento de imagem, manipulação, som, vídeo, Inteligência artificial, finalidade, Assédio moral, constrangimento, mulher, Violência doméstica, violência contra a mulher.;Notificacao para Publicação Intermediária;2025-10-15;;0.5054;TOTAL (2 Termos);0.3817
PL 1310/2025;Projeto de Lei;2025-03-28;Bruno Ganem;PODE;Altera a Lei nº 13.756, de 12 de dezembro de 2018, que dispõe sobre o Fundo Nacional de Segurança Pública (FNSP) e outras matérias, a fim de condicionar o recebimento de seus recursos à implementação de tecnologias de inteligência artificial nas ouvidorias e corregedorias dos órgãos de segurança pública, nos termos que especifica.;https://www.camara.leg.br/proposicoesWeb/prop_mostrarintegra?codteor=2875075;https://www.camara.leg.br/proposicoesWeb/fichadetramitacao?idProposicao=2490966;Alteração, Legislação, Fundo Nacional de Segurança Pública (FNSP), destinação, Recursos financeiros, Investimento público, Inteligência artificial, modernização, Ouvidoria pública, Órgão de segurança pública.;Saída de Relator(a) da Comissão - Sem Parecer Apresentado;2026-02-03;Aguardando Designação - Aguardando Devolução de Relator(a) que deixou de ser Membro;0.5026;TOTAL (2 Termos);0.3782
PL 4510/2020;Projeto de Lei;2020-09-09;Afonso Florence;PT;"Estabelece nova definição sobre o que se entende como atividade de inteligência do Estado, dispõe sobre a tipificação criminal do desvio de finalidade em atividades inerentes aos serviços de inteligência e altera a Lei nº 9.883, de 7 de dezembro de 1999 (Cria o Sistema Brasileiro de Inteligência e a ABIN); e a Lei nº 13.869, de 5 de setembro de 2019 (Crimes de Abuso de Autoridade).";https://www.camara.leg.br/proposicoesWeb/prop_mostrarintegra?codteor=1929005;https://www.camara.leg.br/proposicoesWeb/fichadetramitacao?idProposicao=2262414;Alteração, Lei da Agência Brasileira de Inteligência, definição, atividade de inteligência, inteligência de Estado, finalidade, preservação, soberania nacional, defesa, Estado democrático de direito. _Alteração, Lei de Abuso de Autoridade (2019), tipificação de conduta, desvio de poder, atividade, inteligência de Estado, violação de intimidade, liberdade de expressão, liberdade de pensamento, produção, obtenção, compartilhamento, informação, vida privada, ideologia política, atividade cívica.;Designação de Relator(a);2025-08-07;Aguardando Parecer;0.5023;PARCIAL (1 Termo);0.5029
PL 4025/2023;Projeto de Lei;2023-08-21;Marx Beltrão;PP;Esta lei altera a Lei nº 10.406, de 10 de janeiro de 2002 - Código Civil, e a Lei nº 9.610, de 19 de fevereiro de 1998, dispondo sobre a utilização da imagem de uma pessoa, viva ou falecida, e dos direitos autorais, decorrentes da utilização de inteligência artificial.;https://www.camara.leg.br/proposicoesWeb/prop_mostrarintegra?codteor=2315355;https://www.camara.leg.br/proposicoesWeb/fichadetramitacao?idProposicao=2380982;Alteração, Código Civil (2002), utilização, imagem, pessoa viva, pessoa falecida, manipulação, inteligência artificial, autorização. _Alteração, Lei dos Direitos Autorais (1998), Obra gerada por inteligência artificial, criação, sistema de inteligência artificial, ausência, proteção, direito autoral. _Autorização, utilização, obra intelectual, treinamento, sistema de inteligência artificial.;Publicação de Proposição;2026-02-02;Aguardando Designação de Relator(a);0.4983;TOTAL (2 Termos);0.3729
PL 1243/2025;Projeto de Lei;2025-03-26;Jonas Donizette;PSB;Altera as Leis n° 9.279, de 1996, e 9.610, de 1998, de modo a permitir o registro de pseudônimo ou apelido notoriamente conhecidos de menores de dezoito anos, representados ou assistidos pelos pais ou representante legal bem como a fim de regular direitos conexos relativos a conteúdo multimídia gerado por inteligência artificial;https://www.camara.leg.br/proposicoesWeb/prop_mostrarintegra?codteor=2873525;https://www.camara.leg.br/proposicoesWeb/fichadetramitacao?idProposicao=2490199;Alteração, Lei de Propriedade Industrial (1996), Lei dos Direitos Autorais (1998), autorização, registro, Pseudônimo, Imagem, Alcunha, Menor de idade, Representante legal, utilização, Inteligência artificial, Artista, Esportista, Atleta, Exploração comercial, Marca de comércio.;Saída de Relator(a) da Comissão - Sem Parecer Apresentado;2025-09-02;Aguardando Designação - Aguardando Devolução de Relator(a) que deixou de ser Membro;0.4974;TOTAL (2 Termos);0.3718
PL 6336/2025;Projeto de Lei;2025-12-10;Marcos Tavares;PDT;Dispõe sobre a proteção jurídica do consumidor contra o uso de conteúdos sintéticos e deepfakes em comunicações comerciais, publicidade e fraudes, estabelece deveres de transparência e segurança para fornecedores e plataformas digitais, cria tipos penais e prioridade de persecução para crimes praticados com uso de inteligência artificial e dá outras providências.;https://www.camara.leg.br/proposicoesWeb/prop_mostrarintegra?codteor=3065734;https://www.camara.leg.br/proposicoesWeb/fichadetramitacao?idProposicao=2595747;Diretrizes, Proteção legal, consumidor, Ordem econômica, conteúdo sintético, Deepfake, Sistema de inteligência artificial, Campanha publicitária, golpe financeiro, Fraude eletrônica, obrigatoriedade, plataforma digital, rotulagem, conteúdo digital, Inteligência artificial generativa, descumprimento, responsabilidade civil, responsabilidade penal.;Apresentação de Proposição;2025-12-10;Aguardando Despacho do Presidente da Câmara dos Deputados (Chancela);0.4933;TOTAL (2 Termos);0.3667
PL 19/2026;Projeto de Lei;2026-02-02;Carlos Zarattini;PT;Estabelece condições, deveres e restrições ao uso de óculos inteligentes com recursos de inteligência artificial, altera a Lei nº 9.503, de 23 de setembro de 1997 (Código de Trânsito Brasileiro) e o Decreto-Lei nº 2.848, de 7 de dezembro de 1940 (Código Penal), e dá outras providências.;https://www.camara.leg.br/proposicoesWeb/prop_mostrarintegra?codteor=3075824;https://www.camara.leg.br/proposicoesWeb/fichadetramitacao?idProposicao=2600015;Regulamentação, utilização, óculos, inteligência artificial, proteção, dados pessoais, direito à privacidade, segurança pública, responsabilidade civil, fiscalização, diretrizes. _Alteração, Código de Trânsito Brasileiro (1997), descumprimento, infração de trânsito, Código Penal (1940), tipificação de conduta, pena.;Apresentação de Proposição;2026-02-02;Aguardando Chancela e Publicação do Despacho;0.4930;TOTAL (2 Termos);0.3663
PL 7134/2025;Projeto de Lei;2025-12-22;Amom Mandel;CIDADANIA;Altera a Lei nº 12.965, de 23 de abril de 2014 (Marco Civil da Internet), para incluir o princípio fundamental da Não-Discriminação Algorítmica na disciplina do uso da internet no Brasil.;https://www.camara.leg.br/proposicoesWeb/prop_mostrarintegra?codteor=3072674;https://www.camara.leg.br/proposicoesWeb/fichadetramitacao?idProposicao=2599743;Alteração, Marco Civil da Internet (2014), proibição, inteligência artificial generativa, prestação de serviços, serviços essenciais, utilização, algoritmo, reprodução, ampliação, criação, discriminação, diretrizes.;Apresentação de Proposição;2025-12-22;Aguardando Chancela e Publicação do Despacho;0.4926;TOTAL (2 Termos);0.3658
PL 4869/2023;Projeto de Lei;2023-10-05;Marco Brasil;PP;Veda a demissão ou redução da jornada de trabalho dos profissionais da voz e dos intérpretes de Língua Brasileira de Sinais - Libras em razão da utilização de ferramentas de inteligência artificial para produção de conteúdos audiovisuais.;https://www.camara.leg.br/proposicoesWeb/prop_mostrarintegra?codteor=2341398;https://www.camara.leg.br/proposicoesWeb/fichadetramitacao?idProposicao=2394357;Proibição, demissão, redução, jornada de trabalho, profissional, voz humana, Intérprete de língua de sinais, decorrência, utilização, ferramenta tecnológica, inteligência artificial, produção, conteúdo audiovisual.;Encerramento de Prazo;2024-05-07;Aguardando Designação - Aguardando Devolução de Relator(a) que deixou de ser Membro;0.4906;TOTAL (2 Termos);0.3633
PL 3088/2024;Projeto de Lei;2024-08-08;Júnior Mano;PSB;Altera a Consolidação das Leis do Trabalho (CLT) para Altera a Consolidação das Leis do Trabalho (CLT) para dispor sobre a proteção dos trabalhadores frente ao uso da Inteligência Artificial (IA).;https://www.camara.leg.br/proposicoesWeb/prop_mostrarintegra?codteor=2461006;https://www.camara.leg.br/proposicoesWeb/fichadetramitacao?idProposicao=2451411;Alteração, Consolidação das Leis do Trabalho (CLT) (1943), tutela do trabalho, proteção, trabalhador, utilização, boas práticas, inteligência artificial, algoritmo, relações trabalhistas, acesso à informação, transparência, capacitação, saúde ocupacional.;Retirada de Pauta;2025-12-10;Pronta para Pauta;0.4847;TOTAL (2 Termos);0.3558
PL 4400/2024;Projeto de Lei;2024-11-14;Julio Lopes;PP;Altera a Lei n° 9.610, de 1998, Lei de Direito Autoral, de modo a regular os direitos conexos relativos a conteúdo multimídia, gerado por algoritmo, altamente realista, da voz ou imagem de intérprete ou executante identificável e que simule sua participação em obra audiovisual ou fonograma.;https://www.camara.leg.br/proposicoesWeb/prop_mostrarintegra?codteor=2821713;https://www.camara.leg.br/proposicoesWeb/fichadetramitacao?idProposicao=2469586;Alteração, Lei dos Direitos Autorais (1998), réplica digital, Algoritmo, simulação, voz humana, imagem, falsificação, obra audiovisual, obra gerada por inteligência artificial, obrigatoriedade, autorização, titular, remuneração, direito à imagem, direito de propriedade intelectual, informação ao consumidor.;Rejeição de Requerimento;2025-11-26;Pronta para Pauta;0.4829;TOTAL (2 Termos);0.3536
